{
  "$schema":"https://json-schema.org/draft/2020-12/schema",
  "$id":"https://ars-caeli.local/contracts/v0.2/perceptual-stimulus.schema.json",
  "type":"object","additionalProperties":false,
  "required":["schema_version","stimulus_id","generator_id","generator_version","deterministic","randomness_used","seed","family","parameters"],
  "properties":{
    "schema_version":{"const":"0.2-draft"},"stimulus_id":{"type":"string","minLength":1},"generator_id":{"type":"string","minLength":1},"generator_version":{"type":"string","minLength":1},"deterministic":{"type":"boolean"},"randomness_used":{"type":"boolean"},"seed":{"type":["integer","null"]},"family":{"type":"string","minLength":1},"implementation_ref":{"type":["string","null"]},"parameters":{"type":"array","minItems":1,"items":{"$ref":"https://ars-caeli.local/contracts/v0.2/measurement-common.schema.json#/$defs/parameter"}},"rendering_context":{"type":["object","null"]},"symbolic_metadata":{"type":["object","null"],"additionalProperties":false,"properties":{"apl_knowledge_layer":{"const":"symbolic"},"evidence_role":{"const":"source_symbolic"},"operational_authority":{"const":false},"label":{"type":"string"}}}
  }
}
