{"schema_version":"0.2-draft","stimulus_id":"pg.regularity.hex.0002","generator_id":"aeon.hexagonal.regularity","generator_version":"0.1","deterministic":true,"randomness_used":false,"seed":null,"family":"hexagonal_regularity","parameters":[{"parameter_id":"sides","value":6,"unit":"count","role":"stimulus","evidence_role":"experimental_operationalization"},{"parameter_id":"radius","value":120,"unit":"px","role":"stimulus","evidence_role":"experimental_operationalization"},{"parameter_id":"regularity_deviation_ratio","value":0.25,"unit":"ratio","role":"stimulus","evidence_role":"experimental_operationalization"}]}