{"schema_version":"0.2-draft","stimulus_id":"pg.regularity.hex.0001","generator_id":"aeon.hexagonal.regularity","generator_version":"0.1","deterministic":true,"randomness_used":false,"seed":null,"family":"hexagonal_regularity","implementation_ref":"draft-v0.2/reference-only","parameters":[{"parameter_id":"sides","value":6},{"parameter_id":"radius","value":120},{"parameter_id":"rotation_deg","value":0}]}